{
  "schema_version": "3.1.0",
  "dataset_version": "0.13.0.0",
  "generated_at": "2026-08-08T22:49:10Z",
  "frames": [
    {
      "id": "lucy",
      "name": "Lucy walks upright",
      "year": -3178051,
      "anchor_set": "deep-time",
      "summary": "The Australopithecus afarensis skeleton from Hadar in Ethiopia. Bipedal, small-brained, and 600,000 years before anyone knapped a stone.",
      "entity_id": "africa.prehistory.hadar"
    },
    {
      "id": "laetoli-footprints",
      "name": "Oldest footprints",
      "year": -3658051,
      "anchor_set": "deep-time",
      "summary": "Hominins walked across wet volcanic ash at Laetoli in Tanzania and the prints set. The oldest direct record of upright walking, older than any stone tool.",
      "entity_id": "africa.prehistory.laetoli"
    },
    {
      "id": "first-stone-tools",
      "name": "First stone tools",
      "year": -3298051,
      "anchor_set": "deep-time",
      "summary": "The oldest known deliberately knapped stone, at Lomekwi 3 in Kenya. Half a million years before the oldest fossil of our own genus.",
      "entity_id": "global.prehistory.firsts.stone-knapping"
    },
    {
      "id": "first-homo",
      "name": "First Homo fossil",
      "year": -2798051,
      "anchor_set": "deep-time",
      "summary": "The oldest fossil attributed to our genus, from Ledi-Geraru in Ethiopia.",
      "entity_id": "global.prehistory.hominins"
    },
    {
      "id": "first-fire",
      "name": "Controlled fire",
      "year": -998051,
      "anchor_set": "deep-time",
      "summary": "The earliest secure evidence of fire kept and used on purpose, at Wonderwerk Cave in South Africa.",
      "entity_id": "global.prehistory.firsts.controlled-fire"
    },
    {
      "id": "first-sapiens",
      "name": "First Homo sapiens",
      "year": -313050,
      "anchor_set": "deep-time",
      "summary": "The earliest fossils of our own species, from Jebel Irhoud in Morocco. Roughly a tenth of the way back to the first stone tools.",
      "entity_id": "global.prehistory.hominins.homo-sapiens"
    },
    {
      "id": "neanderthal-extinction",
      "name": "Neanderthals disappear",
      "year": -38051,
      "anchor_set": "deep-time",
      "summary": "The last traces of Neanderthals, after some 360,000 years across Europe and western Asia.",
      "entity_id": "global.prehistory.hominins.homo-neanderthalensis"
    },
    {
      "id": "last-glacial-maximum",
      "name": "Last Glacial Maximum",
      "year": -24050,
      "anchor_set": "deep-time",
      "summary": "The coldest point of the last Ice Age, when ice sheets reached their greatest extent and sea level was about 120 m lower than today.",
      "entity_id": "global.paleolithic"
    },
    {
      "id": "holocene-start",
      "name": "Start of the Holocene",
      "year": -9750,
      "anchor_set": "deep-time",
      "summary": "The end of the last Ice Age and the start of the present geological epoch, 11,700 years before 1950. Farming begins within two thousand years of it, nearly everywhere independently.",
      "entity_id": "global.neolithic"
    },
    {
      "id": "life-jesus",
      "name": "Life of Jesus",
      "year": -4,
      "end_year": 30,
      "anchor_set": "western",
      "summary": "Traditional dates for the life of Jesus of Nazareth."
    },
    {
      "id": "fall-rome-west",
      "name": "Fall of Western Rome",
      "year": 476,
      "anchor_set": "western",
      "summary": "Deposition of Romulus Augustulus; conventional end of the Western Roman Empire.",
      "entity_id": "europe.mediterranean.rome.empire"
    },
    {
      "id": "fall-constantinople",
      "name": "Fall of Constantinople",
      "year": 1453,
      "anchor_set": "western",
      "summary": "Ottoman conquest ends the Byzantine Empire; conventional end of the Middle Ages.",
      "entity_id": "cross-regional.ottoman.mehmed2"
    },
    {
      "id": "columbus",
      "name": "Columbus reaches the Americas",
      "year": 1492,
      "anchor_set": "western",
      "summary": "Christopher Columbus's first landfall in the Bahamas; the beginning of sustained European contact with the Americas.",
      "entity_id": "cross-regional.columbus"
    },
    {
      "id": "american-revolution",
      "name": "American Revolution",
      "year": 1775,
      "end_year": 1783,
      "anchor_set": "western",
      "summary": "Colonial revolt that produced the first successful independence movement in the Americas."
    },
    {
      "id": "french-revolution",
      "name": "French Revolution",
      "year": 1789,
      "anchor_set": "western",
      "summary": "Overthrew the French monarchy and ancien régime; template for modern political revolutions.",
      "entity_id": "europe.western.france.revolution"
    },
    {
      "id": "ww1",
      "name": "World War I",
      "year": 1914,
      "end_year": 1918,
      "anchor_set": "global",
      "summary": "First industrialized total war; collapsed four empires (Russian, German, Austro-Hungarian, Ottoman).",
      "entity_id": "cross-regional.ww1"
    },
    {
      "id": "ww2",
      "name": "World War II",
      "year": 1939,
      "end_year": 1945,
      "anchor_set": "global",
      "summary": "Global war fought in Europe, Asia, and the Pacific; ended with Axis defeat and the atomic bombings of Hiroshima and Nagasaki.",
      "entity_id": "cross-regional.ww2"
    },
    {
      "id": "confucius",
      "name": "Life of Confucius",
      "year": -551,
      "end_year": -479,
      "anchor_set": "east-asian",
      "summary": "Life of the Chinese philosopher Kongzi."
    },
    {
      "id": "buddha",
      "name": "Life of the Buddha",
      "year": -563,
      "end_year": -483,
      "anchor_set": "south-asian",
      "summary": "Traditional dates (varies by tradition)."
    },
    {
      "id": "qin-unification",
      "name": "Qin Unification of China",
      "year": -221,
      "anchor_set": "east-asian",
      "summary": "Qin Shi Huangdi ended the Warring States period and founded the first unified Chinese empire.",
      "entity_id": "east-asia.china.qin.shi-huang"
    },
    {
      "id": "meiji-restoration",
      "name": "Meiji Restoration",
      "year": 1868,
      "anchor_set": "east-asian",
      "summary": "Ended the Tokugawa shogunate and restored imperial authority under Emperor Meiji; launched Japan's rapid modernization.",
      "entity_id": "east-asia.japan.modern.meiji"
    },
    {
      "id": "prc-founding",
      "name": "Founding of the PRC",
      "year": 1949,
      "anchor_set": "east-asian",
      "summary": "Mao Zedong proclaimed the People's Republic of China after Communist victory in the Chinese Civil War.",
      "entity_id": "east-asia.china.prc"
    },
    {
      "id": "muhammad",
      "name": "Life of Muhammad",
      "year": 570,
      "end_year": 632,
      "anchor_set": "islamic",
      "summary": "Life of the Prophet Muhammad, founder of Islam. His flight from Mecca to Medina in 622 marks Year 1 of the Islamic calendar.",
      "entity_id": "west-asia.arabia.rise-islam.muhammad"
    },
    {
      "id": "hijra",
      "name": "The Hijra (Muhammad's migration)",
      "year": 622,
      "anchor_set": "islamic",
      "summary": "Year 1 of the Islamic calendar."
    },
    {
      "id": "sack-baghdad",
      "name": "Mongol Sack of Baghdad",
      "year": 1258,
      "anchor_set": "islamic",
      "summary": "Hülegü Khan's Mongols destroyed Baghdad and ended the Abbasid Caliphate; a symbolic close to the Islamic Golden Age.",
      "entity_id": "cross-regional.abbasid"
    },
    {
      "id": "ashoka-conversion",
      "name": "Ashoka's conversion (Kalinga War)",
      "year": -261,
      "anchor_set": "south-asian",
      "summary": "Mauryan emperor Ashoka's remorse after the bloody conquest of Kalinga led him to embrace Buddhism and pacifism.",
      "entity_id": "south-asia.maurya.ashoka"
    },
    {
      "id": "indian-independence",
      "name": "Indian Independence & Partition",
      "year": 1947,
      "anchor_set": "south-asian",
      "summary": "End of the British Raj; partition into independent India and Pakistan produced one of history's largest forced migrations.",
      "entity_id": "south-asia.independence"
    },
    {
      "id": "great-pyramid",
      "name": "Great Pyramid of Giza built",
      "year": -2560,
      "anchor_set": "african",
      "summary": "Traditional date of the Great Pyramid of Khufu at Giza; the oldest of the Seven Wonders and the only one still standing.",
      "entity_id": "africa.nile.egypt.old-kingdom.dyn4.khufu"
    },
    {
      "id": "mansa-musa-hajj",
      "name": "Mansa Musa's Hajj",
      "year": 1324,
      "anchor_set": "african",
      "summary": "Mansa Musa of Mali's pilgrimage to Mecca was so lavish it crashed Egyptian gold prices for a decade.",
      "entity_id": "africa.west.mali.mansa-musa"
    },
    {
      "id": "adwa",
      "name": "Battle of Adwa",
      "year": 1896,
      "anchor_set": "african",
      "summary": "Ethiopian victory over Italy; kept Ethiopia the only major African state to remain uncolonized in the age of European empires.",
      "entity_id": "africa.nile.ethiopia.menelik2"
    },
    {
      "id": "cahokia-peak",
      "name": "Cahokia at peak",
      "year": 1100,
      "anchor_set": "americas",
      "summary": "Mississippian city near modern St. Louis; the largest pre-Columbian settlement in North America.",
      "entity_id": "americas.north.mississippian"
    },
    {
      "id": "aztec-fall",
      "name": "Fall of Tenochtitlan",
      "year": 1521,
      "anchor_set": "americas",
      "summary": "Spanish conquistadors under Cortés, allied with Tlaxcala and other indigenous nations, took the Aztec capital.",
      "entity_id": "americas.mesoamerica.aztec.moctezuma2"
    },
    {
      "id": "inca-fall",
      "name": "Fall of the Inca",
      "year": 1533,
      "anchor_set": "americas",